 Lorem ipsum dolor sit amet, consectetur adipiscing elit. Aenean ac nunc sed risus mollis ultrices. Sed in ornare lacus. Maecenas rhoncus, nunc at maximus pulvinar, metus nibh accumsan lectus, id tincidunt tortor erat vitae ipsum. Lorem ipsum dolor sit amet, consectetur adipiscing elit. Donec semper eros id lectus facilisis, vitae consequat nunc faucibus. Nam cursus dolor nec metus dignissim, et tempus erat efficitur. Donec pretium eros id iaculis efficitur. Etiam cursus blandit lorem. Proin ac sapien vitae elit porta malesuada id eget velit. Nullam sit amet lacus eu neque sodales cursus. Sed vitae sapien aliquam, imperdiet ante et, dapibus augue. Cras vitae nisi vel felis vestibulum mattis eu nec ex.

Nullam nec enim tortor. Sed et dignissim quam, sed consequat orci. Aliquam fringilla euismod elit, non dapibus elit convallis at. Vivamus aliquam mauris leo, non consequat massa faucibus et. Mauris cursus lectus massa, et pellentesque orci bibendum sed. Proin mollis, orci et imperdiet pretium, est nunc commodo neque, in elementum enim erat eget turpis. Cras lobortis varius odio at mollis. Donec vitae est eget massa gravida eleifend a in dui. Vestibulum justo lectus, gravida sed convallis et, varius quis orci.

Duis accumsan, enim in maximus maximus, libero lorem pellentesque quam, eget ornare ligula arcu vel tellus. Mauris ultricies euismod lectus in vulputate. Integer blandit pellentesque elit in dapibus. Pellentesque egestas, enim in pellentesque rhoncus, nulla nulla interdum erat, et mattis mauris massa quis odio. Ut sed nisl laoreet, rhoncus lacus at, rhoncus augue. Nulla ut orci ligula. Sed neque sem, sagittis ut elementum quis, imperdiet ut magna. Aliquam ac pulvinar ipsum. Praesent consequat, elit eget mattis mattis, ante purus venenatis quam, tincidunt accumsan dolor risus vitae diam. Vestibulum tempus sem id elit cursus, eget euismod nisl venenatis. Etiam id libero vitae mauris ultricies pulvinar. Donec porta, metus sed tincidunt pulvinar, justo urna convallis est, non congue turpis est at quam.

Cras molestie, elit at euismod suscipit, tellus tortor mattis justo, et pulvinar urna velit eu erat. In a pulvinar orci. Vestibulum neque eros, tempor sit amet lorem laoreet, dictum congue turpis. In placerat tincidunt leo, sit amet molestie lacus congue id. Etiam ultrices ultrices nisl. Nullam eget cursus diam. In pellentesque lectus tincidunt dui gravida, at consectetur ex faucibus. Proin sed libero elit.

Aliquam sodales hendrerit ornare. Aenean lacinia fermentum purus, a tempus tortor. Nulla facilisi. Donec imperdiet diam laoreet mollis feugiat. Vivamus ac dolor porttitor, condimentum dolor vel, vulputate felis. Proin volutpat lectus eu turpis volutpat, ut feugiat diam lacinia. Morbi placerat, nibh non eleifend gravida, sapien lorem commodo leo, a euismod dolor velit sit amet leo. Vivamus accumsan gravida tellus, sed suscipit urna egestas eu. Cras ut sagittis ex. Praesent consectetur iaculis interdum. Suspendisse potenti.

Pellentesque maximus velit et sapien dignissim elementum eget tristique est. Vivamus vitae aliquam justo, vel convallis purus. Proin varius eros et pulvinar mollis. Duis sodales, felis id luctus eleifend, lorem nulla gravida diam, a luctus erat nisl eget purus. Duis aliquet rhoncus ex, posuere iaculis diam sodales a. Donec lacinia eget leo vel rhoncus. Aliquam sed tincidunt urna. Suspendisse potenti. Donec malesuada nec eros sit amet fringilla. Interdum et malesuada fames ac ante ipsum primis in faucibus. Etiam eros nulla, vulputate et euismod sit amet, maximus eget erat. Phasellus massa turpis, feugiat ac luctus eget, convallis quis urna. Vestibulum elementum, urna eget vestibulum pellentesque, mi nisl volutpat orci, vel blandit ligula ipsum eu augue. Suspendisse fermentum in purus sit amet pharetra.

Praesent quis felis condimentum, vehicula lectus ut, sodales sapien. Curabitur blandit posuere convallis. Ut consequat justo quis lectus sollicitudin convallis. Suspendisse feugiat nunc at congue mollis. Mauris eget nunc a lacus fringilla luctus sit amet condimentum enim. Fusce mi metus, imperdiet ut dui quis, iaculis mattis neque. Morbi vulputate mi mauris. Maecenas aliquam odio nec urna tempus vestibulum in sed felis. Nam vulputate lacus nec vehicula cursus. Proin porttitor mi augue, dapibus ullamcorper ante auctor ut. In in consectetur ipsum. Maecenas tellus lectus, congue eu nunc in, ultrices scelerisque enim. Maecenas et lectus mi. Nulla mauris leo, euismod sit amet congue in, tempus quis quam. Nullam nulla quam, ornare ut libero sed, bibendum aliquet purus. Vivamus vitae felis sapien.

Praesent ut mi vel leo auctor ullamcorper ac in dolor. Etiam velit augue, ornare quis fringilla quis, convallis id elit. In erat ligula, bibendum nec ullamcorper ut, hendrerit vehicula ligula. Quisque in quam sed sem scelerisque porttitor. Ut semper, velit at posuere posuere, neque diam tristique metus, eget dapibus purus nunc non lorem. Vestibulum semper varius molestie. Vivamus nisl erat, dapibus id sapien ac, vestibulum placerat magna. Maecenas at suscipit libero, quis laoreet libero. Nulla luctus commodo est.

Morbi volutpat neque sed sapien faucibus imperdiet. Nam posuere vehicula sapien sed egestas. Aenean et nunc feugiat, sodales quam vitae, mattis eros. Aliquam pellentesque imperdiet orci, nec ullamcorper magna viverra a. Interdum et malesuada fames ac ante ipsum primis in faucibus. Suspendisse commodo luctus quam, eu dictum neque placerat sit amet. Sed enim risus, dictum nec pharetra ac, ullamcorper vulputate ligula. Donec venenatis, velit quis pellentesque ullamcorper, neque justo fringilla lorem, non luctus magna nisl vitae leo. Etiam elementum elit commodo nisi congue luctus. Proin a felis erat.

In hac habitasse platea dictumst. Donec volutpat mi vitae bibendum pulvinar. Sed hendrerit vehicula lectus, eget sagittis neque vestibulum vitae. Donec eget metus dapibus, vulputate mi venenatis, egestas turpis. Nunc aliquet justo ut libero dignissim, nec ultricies arcu imperdiet. Mauris eu lobortis neque. Sed pulvinar euismod ante, vel rutrum nisi congue quis. Maecenas blandit orci tellus, quis pharetra neque ornare semper. Integer et volutpat libero, eu dignissim dui. Sed cursus neque interdum sodales luctus. Aliquam dapibus nunc vel vulputate pellentesque. Quisque pulvinar placerat nisl, quis venenatis mi porta id.

Integer purus sapien, ultrices eget nisl ut, facilisis interdum ante. Aenean porttitor fringilla ex. Aliquam quis mattis diam. Nullam tincidunt pellentesque dolor, vitae lobortis dolor dictum sed. Morbi fermentum, felis et laoreet gravida, urna erat mollis tellus, pretium egestas enim tortor at massa. Cras maximus tempus arcu eget semper. Vestibulum accumsan a arcu in bibendum. Donec mi eros, dapibus at iaculis quis, aliquam at nisi. Mauris sapien odio, imperdiet in leo ac, dignissim commodo turpis.

Maecenas porta sodales arcu, a finibus velit lobortis sed. Morbi vestibulum quam ut tempor lacinia. Nam id risus non ligula faucibus viverra. Curabitur sollicitudin risus sit amet mauris commodo congue. Phasellus mollis felis at leo scelerisque, id vulputate ex placerat. Vivamus cursus lobortis magna, nec maximus ante. Suspendisse potenti. Proin quis ornare massa, ut pulvinar enim. Proin efficitur erat vel velit bibendum lobortis. Mauris ligula dui, venenatis a dapibus vel, molestie eget ipsum. Mauris urna enim, semper sit amet ullamcorper sed, bibendum nec mi. Proin non venenatis nulla, in rutrum purus.

